구분,행사명,날짜,장소,주최자,내용
공연,스누풀 SNUPOOL에서 2023-2 신입부원을 모집합,2023-11-09,서울대학교 포스코 스포츠센터 71-2동 3층 수영장,서울대 스누풀 수영,안녕하세요. 서울대학교의 수영동아리 스누풀 입니다! 수영을 좋아하시는 분 수영 실력을 재미있게 늘리고 싶으신 분 또는 여러 사람들과 건강한 라이프 스타일 함께 만들어 보고 싶은 분들은 누구든 스누풀러가 되실 수 있습니다! 저희 스누풀에 대해서 알아볼까요?    토요일 정기 수영모임 및 타 대학 교류전  매주 토요일 오후 2시 서울대 포스코 수영장에서 함께 수영하는 정기모임을 갖습니다. 실력에 따라 초급 중급 상급 레인에서 훈련합니다. 2시간의 훈련이 끝난 후에는 즐거운 뒤풀이를 갖습니다.  - 활동 위치: 서울대학교 포스코 스포츠센터 71-2동 3층 수영장   멘토-멘티 프로그램 (월~금 오전/오후)  수준에 맞춰 멘토에게 배울 수 있는 기회! 뛰어난 수영 실력을 갖추고 있는 기존 회원들을 멘토로 선발합니다. 신입회원들은 멘티로서 자유롭게 프로그램에 참여할 수 있습니다. 꾸준히 프로그램에 참여하다 보면 어느새 수영이 쉬워진답니다.   각종 수영 대회 타 대학 교류전 참가 및 개최  운동 동아리라면 대회를 빼놓을 수 없습니다. 대회에 나가 함께 응원하며 즐기다 보면 스누풀과 끈끈한 가족이 되어 있답니다. 대회를 준비를 위해 함께 훈련하고 향상된 본인의 모습을 보는 멋진 경험을 할 수 있습니다. 정기모임과 대회 외에도 매년 한양대 홍대 서강대 등의 수영동아리와 교류하고 있으며 함께 정모를 진행합니다.   즐거운 계절 MT 및 소모임  수영 외에도 다양한 활동들을 함께합니다. 신입회원들은 각 분기별 신나는 MT를 통해 스누풀러들과 좋은 친구가 되어 유대감을 쌓을 수 있습니다. 이 외에도 간단한 소풍 버들골 모임 홈커밍데이 등의 여러 소모임과 행사들이 준비되어 있습니다. 물론 참가는 자유입니다!    ?가입 조건  - 서울대학교 재학생 (학부대학원박사)  - 50m 완영 가능자 (속도 영법 무관)   ? 지원방법  @snupool 인스타 DM으로 신입 톡방 비밀번호 문의 후 첨부된 링크로 신입 톡방 입장!  신입 톡방: https://open.kakao.com/o/g
공연,SNUPO & SNUpia 하계 앙상블,2023-11-09,서울대학교 문화관 중강당,SNUPO SNUp,서울대학교 아마추어 오케스트라 동아리 SNUPO와 피아노 동아리 SNUpia가 함께하는 앙상블 공연으로 소규모 다양한 곡을 선보이는 행사입니다 :)
공연,SNU_CAA 제1회 정기연합행사 : 연박싱,2023-11-09,학생회관 63동 라운지,서울대학교 문화예술,서울대학교 문화예술연합회 SNU_CAA 출범을 알리는 ‘제1회 정기연합행사 : 연박싱’으로 여러분을 초대합니다! 참여 방법 선착순 80명 선발 신청기한 : 9/6(수) ~ 9/21(금) 아래 구글폼 작성 및 제출 https://forms.gle/pWzaQscbE1oydtaz9  상품도 있다?! 행사 당일에는 팀전으로 여러 미니게임이 진행되며 우승한 팀에게는 메가커피 기프티콘이 제공됩니다! 타 문화예술 동아리 친구도 사귀고 상품도 얻을 수 있는 기회 놓치지 마세요!  [SNU_CAA란?] 총 9개의 교내 동아리 및 자치단체 간의 연합을 중심으로 설립된 SNU_CAA는 음악 미술 극 문학 등의 다양한 활동을 진행하는 예술 동아리 간의 네트워크를 형성해 정기 세션 전시 및 공연을 개최하고 활발한 친목 활동을 진행하는 데 그 목적을 두고 있습니다.  현재 SNU_CAA에는 이미지밴드 미동 창문 알라셩 여민락 소리지기 프레이즈 바운스팩토리 스누엔터라는 총 9개의 동아리가 소속되어 있습니다. 연합회에 대해 더 궁금하신 점이 있다면 아래 노션 링크를 참고해주세요!?https://dldnwn.notion.site/SNU_CAA-a46b56f7d8ad49bc971167430d7cdda7?pvs=4  이번 정기연합행사 ‘연박싱’에서는 연합회 내 소속 동아리들을 소개하는 시간을 가짐과 동시에 바운스팩토리와 스누엔터의 특별공연을 선보일 예정입니다. 문화예술 동아리 부원들과 함께 즐길 수 있는 게임과 행사 후 회식까지 준비되어 있으니 많은 참여 부탁드립니다.  문의 : SNU_CAA 기획협력팀장 이규흔 010-8959-9872
공연,2023 단풍연 가을 판굿,2023-11-09,서울대학교 버들골,서울대 단대풍물패연,서울대학교 단대풍물패연합 단풍연의 2023년 정기 가을 판굿 공연입니다!  다양한 국악기로 임실필봉농악 가락을 연주하며 버들골 전체를 우리 소리로 가득채울 예정입니다!  많은 관심 부탁드려요!! 문의: @snu_danpungyeon (대표: 이동준 010-9877-4733)
공연,2023 미대극회 114회 정기공연 (루나자에서 춤을),2023-11-09,서울대학교 14동 인문소극장,서울대학교 미대극회,1936년 8월 초 루나자 축제 기간 동안에는 먼디 일가의 다섯 자매들을 웃고 울게 할 여러 사건들이 일어나게 됩니다. 그 몽롱하고 생생한 기억속으로 함께 빠져볼까요?
공연,물결의 일일호프,2023-11-09,신촌 바플라이 3호점,물결,시험기간 전 마지막으로 신나게 놀고싶은 분들 !! 새로운 사람 좋은 인연을 만들고 싶으신 분들 !! 바플라이 3호점으로 놀러오세요  입장료  일반 테이블  현장구매: 6000원  사전예매(일반석) : 5000원 입금계좌 : 3333196310036 카카오뱅크 (물결) 링크 : https://forms.gle/BjcTaqk6vDwvUATn6  미팅 테이블 사전예매(미팅석) : 6000원 입금계좌 : 3333196310036 카카오뱅크 (물결) 링크 : https://forms.gle/orW5Hm8SHxHEHKJp8  다양한 이벤트  블라인드 미팅이벤트 1. 입장하시는 남성분들이 자신의 취미 mbti 인스타 아이디를 포스티잇에 적는다. 2. 포스티잇을 게시판에 붙인다. 3. 퇴장하시는 여성분들이 마음에 드는 포스티잇을 가져간다.  베스트 드레서 ‼️ 동아리 물결에 어울리는 파란색 코디를 가장 멋지게 한 분들께 서비스 증정 ‼️  예약안내 예약금 X 인원수를 대표자 1인이 입금 후 구글폼을 작성해주시면 됩니다. 입금자명과 구글폼 작성명을 동일하게 기재해주세요. 미팅 테이블인 2인만 예약가능합니다. 98~04년생까지만 입장가능합니다. 입금 후 환불 불가힙니다.  ----------------------------------  ‼️모든 문의는 인스타그램 디엠과 오픈채팅으로만 받습니다‼️ 인스타그램 : @waves__rise 오픈채팅 : https://open.kakao.com/o/s7G3SUIf
공연,중앙 몸짓패동아리 골패 정기공연,2023-11-09,학생회관,골패,주제: 우리의 모두의 여름
공연,인문대 불문극회 떼아트르 빵타스티끄 원어연극제,2023-11-09,인문관7(14동),떼아트르 빵타스티끄,제목: 아내들의 학교
공연,국악과 축제,2023-11-10,자하연,국악과,제목: 제3회 국악과 여름축제 S-Festival
공연,인문대 원어연극제 일문극회 관악로켓단,2023-11-10,인문관,관악로켓단,제목: 비와 고양이와 몇 가지의 거짓말
공연,음대 관현악과 정기연주회,2023-11-10,문화관,음대,제목: SNU 윈드앙상블 정기연주회
공연,중앙도서관 별빛 영화제,2023-11-10,중앙도서관,중앙도서관,제목: Enjoy Like SNU - 제 4회 도서관 별빛 영화제
공연,혼성 댄스 동아리 혼또니 정기공연,2023-11-10,NH농협두레문예관,혼또니,제목:HONDERLAND
공연,중앙도서관 북 콘서트,2023-11-10,중앙도서관,중앙도서관,주제: 한국 발전주의와 자본주의 다양성 논쟁
공연,2023 인문X사회X자전 연합축제: You in 샤,2023-11-10,자하연,인문대학,우ㄹㅣ도… 이번ㅇㅔ 축제 한ㄷr…관악의 가을을 화려하게 장식할 2023 인문X사회X자전 연합축제 <You in 샤: Back to Y2K>가 10/10(화)~11(수)에 진행됩니다. 여러분들의 많은 관심 부탁드립니다
공연,서울대학교 바시소X새날반 일일호프 새시봉,2023-11-10,신촌 바플라이 2호점,서울대 바시소 새날,서울대학교 바시소X새날반 일일호프 새시봉   7080쎄시봉? 우리만의 레트로 2010 새시봉!  어린 시절의 추억을 되살리고 싶은 분들! 개강 이후에 새로운 친구를 만나고 싶은 분들! 새로운 인연을 만나며 설렘을 즐기고 싶은 분들!  이벤트 안내  학창시절을 떠오르게 하는 2010년대 명곡 들으며 이 노래로 자신있다 하면 스테이지까지?? 이름 좀 날렸던 추억의 예능 게임으로 상품 이벤트! 그 시절 그 아이.. 를 떠올리게 하는 베스트 드레서도 노려보자!  날짜 : 9월 16일 (토)  장소 : 신촌 바플라이 2호점  시간 : 오후 6시 ~ 오전 4시  일반테이블: 1인 5000원  미팅테이블: 1인 6000원 (현장 예매보다 사전 예매가 1000원 더 저렴합니다. 토요일 현장예매 특성상 웨이팅이 있을 수 있으니 사전 예약을 추천드립니다!)  입금계좌: 카카오뱅크 333-327-4229739 강혜윤  #일일호프 #합석보장 #바시소 #새날 #바플라이 #서울대 #신분증지참  미팅테이블(합석보장) 운영: 18:00~20:00 20:00~22:00 22:00~24:00   2:2 / 3:3 / 4:4 모두 가능   미팅테이블 (18:00-20:00 20:00-22:00 22:00~24:00  미팅테이블은 오직 사전예매로만 진행합니다! 선착 마감 전 서둘러 신청해주세요  https://docs.google.com/forms/d/e/1FAIpQLScLMUFf5pQpAk7F1aEx1UnyOPI_gfWmsC91e5PmqadLNjhHmg/viewform?usp=sf_link  일반테이블 (18:00-04:00)  사전예매는 현장예매보다 1000원 할인된 가격으로 진행합니다! 사전예매로 즐겨보세요  ▶ https://docs.google.com/forms/d/e/1FAIpQLSdf42FeK24HYnf_KK0nk6y3FyxWcaRcP-Ha4eWXEdjeOWqQdw/viewform?usp=sf_link  조기마감될 수 있습니다. 서둘러서 예약하세요!   ? 사전예매 링크는 인스타그램
공연,?서울대 ?디자인X기계?️ 일일호프?,2023-11-10,신촌 바플라이 1호점 별밤,서울대 디자인 기계,서울대 디자인X기계?️ 일일호프 “DM to yoU” 사전예약  “야 나 소개팅 좀” “엥? 갑자기 뭔 소개팅이야.. 일일호프나 가;;” “일홉? 이벤트 있겠네???” “DM으로 문의 ㄱㄱ” (문의하실 때는 예쁜 인사말도 함께 부탁드려요!! 저는 답만 하는 로봇이 아니에요 최소한의 예의를 지켜주세요)  본격적으로 2학기를 즐겨보고 싶은 당신!! 서울대 디자인X기계?️ 일일호프가 여러분을 초대합니다  일시 : 9월 20일 (수) 18시 ~ 익일 오전 4시 장소 : 신촌 바플라이 1호점 별밤 (서대문구 연세로9길 10-1 지하)  타 대학 타 학과도 참여 가능합니다!  입장료 : 사전예약 시 일반석 1인 5000원 미팅석 6000원 / 현장입장 6000원 입금계좌 : 우리은행 1002-762-027100 민윤정 (입금자명은 구글폼 작성자명과 동일하게 해주세요!)  예약링크 https://docs.google.com/forms/d/e/1FAIpQLSf3LvwQJM8pKtQ_2vBmII6zLbk2szxe-zPYApbxpJXP9aySTw/viewform?usp=sf_link  사전예약은 9월 20일 오후 3시까지 가능합니다  입장방법  미팅석 (선착순 6000원/1인) 100% 사전예약제로 100% 합석보장 원활한 진행을 위해 2:2로만 진행합니다! 18시 20시에만 한정 운영 합니다!!  일반석 (선착순 5000원/1인) 일반석 사전 예매 시 저렴한 가격에 우선입장까지 가능해 대기시간이 현저히 줄어듭니다! 사전티켓은 한정 수량으로 조기 마감될 수 있습니다! 일반석도 합석보장 (당일 현장 상황에 따라 대기 시간이 발생할 수 있습니다.)  현장 입장 (6000원/1인) 사전예약자 우선 입장 후 입장 가능합니다! 당일 현장 상황에 따라 입장시 대기 시간이 발생할 수 있습니다.  주의사항  입장 시 본인 확인을 위한 신분증을 보여주세요. 바플라이 규정상 99~04년생만 입장 가능합니다. 이용시간은 2시간으로 제한됩니다. 결제는 계좌이체만 가능하며 결제 후 환불은 불가합니다.
공연,사회대연극당 연극,2023-11-10,뜻밖의 극장 (성신여대입구역 도보 3분 / 서울 성북구,서울대학교 사회대연,안녕하세요 관객 여러분! 서울대학교 사회대연극당입니다.  저희 사연당의 제 52회 정기공연 코미디 연극 <모지란 집구석>으로 여러분을 초대합니다!  <모지란 집구석>은 서울대학교 학부생들의 창작극으로 무더운 여름 동안 열심히 준비하여 9월 13-14일 성공적으로 무대를 마쳤고 내일인 9/15 마지막 무대에 올라갑니다.  --------  대가족이 살고 있는 봉천동의 한 부잣집. 웃음도 울음도 소음도 끊이지 않는다. 조금 이상하고 귀여운 이들이 왁자지껄 살아가는 이야기.  --------  공연 장소 : 뜻밖의 극장 (성신여대입구역 도보 3분 / 서울 성북구 동소문로20나길 27 지하 1층)  공연 시간 : 2023.9.13 (수) 오후 8시(마감) 2023.9.14 (목) 오후 8시(마감) 2023.9.15 (금) 오후 4시 오후 7시  러닝타임 : 약 90분 (인터미션 10분 포함)  티켓 가격 : 장당 5000원  전좌석 비지정석으로 공연 시작 15분 전부터 입장 가능합니다. (인터미션 시간을 제외한 중도 입장은 어렵습니다.)  예매 링크 : https://forms.gle/dt5TN5FwUxmEowf3A  문의 : 연출 박유안 010-4121-0867
공연,향록 연극회 신입 공연,2023-11-10,서울대학교 67동 두레문예관 공연장,향록연극회,안녕하세요! 서울대학교 농업생명과학대학 연극 동아리 향록연극회입니다. 즐거운 새 학기 보내고 계신가요? 이번 가을에도 여러분께 재미있는 공연 소식을 전할 수 있게 되었습니다!  # 2023년 신입생 공연 다시 연극‘  장소: 서울대학교 67동 두레문예관 공연장일시: 9월 21-22일(목-금) 매일 16/19시  감독 김승태 각본 조윤상 김승태 배우진: 조윤서 김온 정재은 장하준 김경민 민성욱 최인규 정윤하  러닝 타임: 90분 공연 소개: 공연 당일 말도 없이 사라진 연극배우 혜원이. 6년 만에 다시 돌아와 공연을 올리자고 하는데..  나! 해보고 싶은 게 생겼어. 아니 소원 생겼어.  즐거웠던 그 시절로 다시 돌아간 이 느낌 추억과 오해가 뒤섞여 있다!  ---------- 즐겁고 행복한 관람 되실 수 있도록 남은 기간도 열심히 준비하겠습니다! ----------  기간과 상관없이 신입생 공연과 정기공연에 참여할 새로운 배우/스텝/각본/연출진 학우를 모집하고 있습니다! 인스타로 많은 문의 기다릴께요!   문의: instagram @ever._.green1965
공연,SNU 그랜드 퀘스트 오픈 포럼 안내,2023-11-10,중앙도서관 상산수리과학관 25-1동,서울대학교 국가미래,서울대학교 국가미래전략원에서 오는 ?9월 6일(수)~8일(금)과 13일(수)~15일(금)? 9월 첫째주와 둘째주에 걸쳐 SNU 그랜드 퀘스트 오픈포럼을 개최합니다.  과학기술의 미래를 열어가는 도전적 질문을 찾자는 목표 아래 도출한 ‘그랜드 퀘스트’는 각 분야에서 아직 풀리지 않고 실패할 가능성이 크지만 해법을 구한다면 그 분야의 패러다임을 바꿀 것으로 기대되는 문제입니다.  서울대가 던지는 ‘그랜드 퀘스트’는 과학기술의 미래를 열어갈 한국의 후속세대에게 도전의 목표가 될 것입니다. 나아가 미래의 지형에 먼저 닿고자 고심하는 한국의 산업계에도 도전의 이정표가 될 것으로 기대합니다. 국가미래전략원에서는 10대 분야에 걸쳐 문제를 도출하였으며 분아별로 도출된 그랜드 퀘스트의 중요성과 해결의 어려움을 공유하고 해법의 큰 방향성을 논의하고자 오픈포럼을 기획하고 개최하게 되었습니다.  이번 포럼은 오프라인으로 진행되며 대략적인 인원파악 및 이벤트 진행을 위해 사전 참가신청을 받고 있습니다. 아래의 사전 참가신청 링크를 활용하시거나 <SNU 그랜드퀘스트 홈페이지>에 접속하셔서 참가신청 해주시기 바랍니다. 사전 참가신청을 하신 선착순 20명(학부 및 대학원생 각 세션별)에게 카페 기프트카드를 드릴 예정입니다. 현장참석도 가능합니다.  사전 참가신청 링크 https://docs.google.com/forms/d/e/1FAIpQLScZlnH1Q9i0jukgnMxFwl6UM7VeZX7kM7fh7J98lmqxRqAJmw/viewform  홈페이지  http://snugrandquests.org/  브로셔 링크 https://drive.google.com/file/d/1XzjbLB6chzGUM9cMrFhC1c7J11sFESwl/view  관심있는 분들의 많은 참여를 부탁드립니다. 감사합니다.
공연,씨네꼼 가을 영화제,2023-11-10,서울대학교 두레문예관(67동) 401호 씨네꼼 대상영실,씨네꼼,_영화 속 뱀파이어  서울대학교 영화공동체 씨네꼼에서 가을 영화제를 개최합니다! 이번 영화제의 테마는 “영화 속 벰파이어”로 영화제 기간 중 매일 1편씩 19:00에 상영합니다. 사전 예약 없이 누구나 무료로 관람 가능하니 많은 관심 부탁드립니다!  상영장소  서울대학교 두레문예관(67동) 401호 씨네꼼 대상영실  상영일정  09/18(월) 1900 황혼에서 새벽까지 로버트 로드리게즈 1996 108분 - 09/19(화) 1900 렛미인 토마스 알프레드슨 2008 114분 - 09/20(수) 1900 박쥐 박찬욱 2009 133분 - 09/21(목) 1900 오직 사랑하는 이들만이 살아남는다 짐 자무쉬 2013 123분 - 09/22(금) 1900 뱀파이어에 관한 아주 특별한 다큐멘터리 저메인 클레멘트 2014 86분  각 영화의 포스터 및 소개글은 중앙도서관 터널에서 만나실 수 있습니다!  기획 소개  기획자: 김준수  뱀:파이어는 얼마나 슬펐을까 파:아란 가을하늘도 못보고 이:번 씨네꼼 영화제도 못보고 어:쩌면 좋아  가을이 성큼 다가왔습니다. 개강하기 전 가졌던 설렘과 기대 아직 간직하고 있으신가요. 누군가는 현생에 치어 눈코 뜰 새 없이 바쁜 나날들을 다른 누군가는 삶의 재미를 잃어버린 채 무료한 하루를 살고 있겠지요. 어쨌거나 저마다의 이유로 지친 우리에겐 무력감과 권태로부터 구원해줄 매혹적인 존재가 필요합니다.  과거의 사람들도 같은 마음이었을까요? 답답한 현실에서 잠시나마 도망가고 싶었던 사람들에겐 환상적인 무언가가 필요했습니다. 그것은 단숨에 사람들의 시선을 사로잡고 불멸을 맹세할 수 있으며 그 누구도 확인할 수 없는 존재여야 했습니다. 이러한 상상력이 모여 200년 전 그들을 구해줄 뱀파이어가 태어났습니다.  1819년 영국 소설가 폴리돌리의 「뱀파이어」에서 처음으로 뱀파이어가 대중문학에 나타났습니다. 그로부터 200년이 넘는 시간 동안 뱀파이어는 다양한 작품의 주인공으로 등장했습니다. 독특한 설정과 매력적인 서사 덕에 영화의 단골 소재가 되
공연,SNUPia 제30회 정기연주회,2023-11-10,음악대학 예술관 콘서트홀,SNUpia,안녕하세요! 중앙피아노동아리 SNUPia입니다. 벌써 개강 2주차를 맞이하게 되었습니다. 가을 날씨가 요원해보이는 요즈음 더위를 식힐만한 연주회 소식을 전해드리고자 합니다. SNUPia는 수많은 점검과 연습을 거치며 좋은 연주를 여러분들께 선보이기 위해 노력해왔고 그 결과 제30회 정기연주회를 개최할 수 있게 되었습니다. 이번 정기연주회에서는 12명의 연주자가 약 2시간동안 다양한 곡을 선보일 예정입니다. 영화음악부터 고전 낭만 인상주의 현대곡까지 넓은 스펙트럼의 레파토리로 본 공연을 구성하였습니다. 제각기 다른 느낌을 가지고 있는 각 작품의 매력에 빠져보시길 바랍니다. 많은 관심과 홍보 부탁드립니다. 감사합니다.  일시 : 9월 14일 (목요일) 19시 장소 : 음악대학 예술관 콘서트홀(49동) * 중간 입장이 가능하지만 가급적이면 처음부터 함께 해주세요!
공연,2023 독문극회 <물리학자들> 예매 안내,2023-11-10,14동 지하 1층 인문소극장,독문극회,2023 독문극회 공연 예매 안내   안녕하세요. 서울대학교 독문극회 eS입니다. 2023 원어연극제 독문극회 공연 정보 및 티켓 예매 방법을 안내드립니다. 아래 안내사항을 확인하시어 티켓 예매 부탁드립니다.  공연 정보 - ??? ???????? (물리학자들) * 공연 상연 중 한글 자막이 함께 제공됩니다 * 시놉시스 세계적인 정신과 의사인 찬트 박사가 운영하는 한 정신병원에서 간호사 살인사건이 연달아 발생한다. 가해자는 병원에서 치료 중이던 환자들로 각자 자신의 담당 간호사를 목졸라 살해한다.  자신을 뉴턴이라 주장하는 보이틀러 자신을 아인슈타인이라 주장하는 에르네스티 그리고 솔로몬 왕을 찬미하는 뫼비우스.  저마다의 이유로 정신 병원에 스스로를 격리시킨 세 명의 물리학자 들은 인류와 세상을 위해 모든 것을 함구하고 정신 병원에 남을 것 을 약속한다. 그러나 그들 앞에는 예상치 못한 더 큰 위기가 그들을 기다리고 있는데...  공연 일시 1회차 - 9.22(금) 19시 2회차 - 9.23(토) 14시 3회차 - 9.23(토) 18시  공연장 위치 서울대학교14동 지하 1층 인문소극장  러닝타임 약 100분 (인터미션 없음)  예매 바로가기 https://forms.gle/h8pY8ZDzu9YMttkM8  독문극회에 대해 더 알아보고 싶다면? > 독문극회 인스타그램으로! (@di_es_pielenden)  기타 문의사항은 독문극회 인스타그램 DM 혹은 기획 김은재(010-7678-5358)로 연락 부탁드립니다☺️
공연,서울대학교 서양화과? X 전기정보공학부 lullu 반⚡,2023-11-10,신촌 바플라이 2호점,서울대 서양화과 전,서울대학교 서양화과 X 전기정보공학부 lullu 반 일일호프  “벼ROCK 맞은 서양화“ 일일호프 준비됐어?  날짜 : 9월 15일 (금) 장소 : 신촌 바플라이 2호점 시간 : 오후 6시 ~ 오전 4시  일반테이블: 1인 5000원 미팅테이블: 1인 6000원  (현장 예매보다 사전 예매가 1000원 더 저렴합니다. 금요일 현장예매 특성상 웨이팅이 있을 수 있으니 사전 예약을 추천드립니다!)  입금계좌: 신한 110-545-416165 이준표  #일일호프 #합석보장 #벼rock맞은_서양화 #극rock #바플라이 #서울대 #신분증지참  미팅테이블(합석보장) 운영: 18:00~20:00 20:00~22:00 2:2 / 3:3 / 4:4 모두 가능   미팅테이블 (18:00-20:00 20:00-22:00) 미팅테이블은 오직 사전예매로만 진행합니다! 선착 마감 전 서둘러 신청해주세요 https://m.site.naver.com/1c4ZJ  일반테이블 (18:00-04:00) 사전예매는 현장예매보다 1000원 할인된 가격으로 진행합니다! 사전예매로 즐겨보세요 https://m.site.naver.com/1c4ZJ   조기마감될 수 있습니다. 서둘러서 예약하세요!  사전예매 링크는 @snu_artelc_ilhof 프로필 하단에 있습니다. 모든 문의는 @snu_artelc_ilhof 로 디엠 부탁드립니다.  주의사항 당일 실물 신분증 지참 필수  사진 신분증 학생증 불가  반드시 신분증 (주민등록증 여권 운전면허증)을 지참해주세요! 실물 신분증이 없이 학생증 신분증 사진으로는 입장이 불가능합니다. 바플라이 규정상 99-04년생만 입장가능합니다. 양해 부탁드립니다!
공연,?서울대학교 합창단 제 40회 정기 연주회?,2023-11-10,문화관 대강당,합창단,안녕하세요!! 서울대학교 합창단입니다 저희 합창단이 내일 9월 8일 오후 7시에 서울대학교 문화관 대강당에서 정기연주회를 개최합니다 공연곡을 포함한 공연에 대한 정보는 아래 팜플렛을 참고해주세요!! 많은 관심 부탁드립니다
