구분,행사명,날짜,장소,주최자,내용
학술,[전공설계2 공개특강] 서울대 뇌인지과학과 & 자유전공,2023-11-09,220동 201호,자유전공학부,전공설계2 교과목 수업의 일환으로 여러 분야의 교수 및 전문가를 초청하는 시간을 갖고 있습니다.    이번에는 서울대 뇌인지과학과 & 자유전공학부 이상아 교수님을 초청했습니다.    공개강좌로 진행할 예정이오니 관심있는 학생들의 많은 참여 바랍니다. 자세한 사항은 아래와 같습니다.      - 일시: 2023년 5월 2일(화) 오후 5시    - 장소: 220동 201호    - 연사: 서울대 뇌인지과학과 & 자유전공학부 이상아 교수님    - 강연 제목: Studying the Human Mind Through Brain and Cognitive Sciences    - 강연 개요: In order to understand why we perceive think remember feel and behave in the way we do we must first unlock the mystery of how the brain works. In this talk I will provide an overview of how biological and computational approaches to the study of the mind has made it possible for humanity to begin to explain who we are scientifically.        - 이력/약력:    <Education>  □ B.S. California Institute of Technology Astronomy (천문학)  □ M.A./ PhD Harvard University Psychology (심리학)    <Career>  □ 2021- Associate Professor Department of Brain and Cognitive Sciences Seoul National University  □ 2020-2021 Associate Professor Department of Bio and Brain Engineering Korea Adva
학술,2023년 1학기 서울대학교 자유전공학부 <자연과학융합,2023-11-09,220동 201호,자유전공학부,(1) 패트리샤 처칠랜드의 <뇌처럼 현명하게> (Brain-Wise: Studies in Neurophilosophy)       - 주제: 처칠랜드의 신경철학과 철학적 자연주의   - 일시: 2023년 4월 26일 (수) 오후 6시~ 오후 8시30분    - 장소: 서울대학교 220동 201호      - 강연자: 박제윤 박사 (인천대학교 기초교육원 교수 역임)   - 강연자의 저서 및 번역서   - 저서: 철학하는 과학 과학하는 철학 1-4 시리즈   - 역서: 패트리샤 처칠랜드의 <뇌과학과 철학> <신경 건드려보기>   폴 처칠랜드의 <플라톤의 카메라>            (2) 레슬리 밸리언트의 <기계학습을 다시 묻다> (Probably Approximately Correct)      - 주제: 기계학습의 이해를 돕는 컴퓨터과학 이야기   - 일시: 2023년 5월 31일 (수) 오후 6시~ 오후 8시30분   - 장소: 서울대학교 220동 201호      - 강연자: 이광근 교수 (서울대학교 컴퓨터공학부)   - 강연자의 저서: 컴퓨터과학이 여는 세계: 세상을 바꾼 컴퓨터 소프트웨어의 원천 아이디어 그리고 미래
학술,캠퍼스아시아 겨울 단기프로그램 아시아에서의 평화 구축 ,2023-11-09,220동 201호,자유전공학부,자유전공학부 캠퍼스아시아 겨울 단기프로그램의 일환으로 “Peace-Building in Asia”와 한국문화와 관련된 특강이 예정되어 있습니다. 자유전공학부 학생 중 겨울 단기프로그램 참가학생이 아니더라도 특강에 참석하실 수 있으니 관심있는 학생들의 많은 참여바랍니다.    특강 1  제목: The Dilemma of Pacifism  강사: 박성우 교수(정치외교학부)  일시: 2023년 2월 7일(화) 오전 10시~12시  장소: 220동 201호    특강 2  제목: DMZ and Peace Tourism  강사: 김지나 전문위원(자유전공학부)  일시: 2023년 2월 8일(수) 오전 10시~12시  장소: 220동 201호    특강 3  제목: The U.S.-China Competition and the Korean Peninsula  강사: 신성호 교수(국제대학원)  일시: 2023년 2월 14일(화) 오전 10시~12시  장소: 220동 201호    특강 4  제목: Introduction to Korean Traditional Music  강사: 김승근 교수(국악과)  일시: 2023년 2월 16일(목) 오전 10시~12시  장소: 220동 201호    *모든 특강은 영어로 진행됩니다.    - 신청방법: smkwriter@snu.ac.kr로 성명 / 학번 / 소속 / 오프라인 또는 온라인 참석 작성하여 메일 발송    - 관련 문의: 김수민 전문위원(02-880-9547 smkwriter@snu.ac.kr)
학술,제13회 벼리모임 신청 공지,2023-11-09,강원도 속초 일대,자유전공학부,우리 자유전공학부의 전체 모임인 제13회 벼리모임이 2023년 8월 30일(수)부터 8월 31일(목)까지 1박 2일 일정으로 열립니다.     ‘벼리(綱)’라는 명칭은 ‘고기 잡는 그물의 코를 꿰어 그물을 잡아당길 수 있게 한 동아줄’을 의미합니다. 벼리모임은 자유전공학부의 가장 크고 중요한 행사의 하나이며 자유전공학부 구성원 네트워크의 근간이 될 긴밀한 유대의 형성과 새로운 문화 체험의 장을 마련하는 것을 목적으로 합니다.      이 모임에는 원칙적으로 모든 자유전공학부 구성원이 적극적으로 참가할 것을 기대하고 또 권유하고 있습니다. 다만 참가 가능 인원이 한정되어 있고 원활한 프로그램 기획을 위해서 미리 참가 신청을 받기로 했습니다. 참가를 희망하는 학생은 참가 신청 마감일까지 반드시 신청을 해주기 바랍니다. 사전 신청을 하지 않고 당일에 불쑥 나타나는 것은 허용되지 않습니다.      학부에서는 벼리모임을 비롯한 다양한 교과ㆍ비교과 프로그램 및 행사를 운영하고 있으며 이러한 프로그램과 행사에 대한 학생의 참여도를 지속적으로 확인하고 있습니다. 또한 프로그램이나 행사를 운영하는 가운데 신청자 수가 참여 가능 인원보다 많을 경우 당연히 적극적으로 성실하게 참여해온 학생을 우선적으로 선발하게 됩니다. 이때 참가 신청을 하고 아무 연락 없이 나타나지 않는 학생은 부정적 평가를 받게 되니 유념하기 바랍니다.      이번 벼리모임은 자유전공학부의 전 학생이 모처럼 모여서 우리 학부의 현황을 이해하는 동시에 선후배 동기들과 1박2일 간 함께 생활하며 서로의 경험을 공유하는 자리입니다. 그러므로 학부의 교직원은 가급적 많은 학생이 참여하여 유익한 시간이 되기를 간절히 희망하고 있습니다.      자유전공학부장         - 기 간 : 2023년 8월 30일(수) ~ 31일(목)   - 장 소 : 강원도 속초 일대   - 신청방법: 우측 구글 설문지 작성 >> https://forms.gle/pkPp19MNSbsL5JAt6   - 신청기한 : 6월 22일(목) 오
학술,인종 차별과 건강할 권리,2023-11-09,서울대학교 보건대학원 221동 113호,서울대학교 보건대학,유엔 인종차별철폐위원회 부의장을 맡고 계시는 Tina Stavrinaki 교수님을 연자로 모시고 건강재난 통합대응을 위한 교육연구단과 서울대학교 보건대학원 보건학과 보건정책관리학전공의 연계 세미나를 진행합니다.
학술,조정은 간단한 개념을 만든다,2023-11-09,서울대학교 사회과학대학 대회의실(16동 312호),서울대학교 정치외교,안녕하십니까.   서울대학교 정치외교학부 10-10 사업단에서 2023년 10월 12일 목일에 UCLA의 Michael Chwe 교수님을 모셔 ”Coordination Causes Coarse Concepts을 주제로 강연을 개최합니다.   * 제목: Coordination Causes Coarse Concepts  * 일시: 2023년 10월 12일 목요일 15:00~17:00  * 장소: 서울대학교 사회과학대학 대회의실(16동 312호)   자세한 내용은 아래 포스터를 참고해 주시기를 바랍니다.   학내 구성원 여러분의 많은 관심과 참여 부탁드립니다.   감사합니다.   정치외교학부 10-10 사업단
학술,제 7회 GDI 오픈 하우스 “국제개발협력 길라잡이”,2023-11-09,서울대학교 행정대학원 57동 204호,글로벌행정발전연구소,안녕하세요 서울대학교 글로벌행정발전연구소 입니다.   글로벌행정발전연구소(GDI)에서는 국제개발협력에 대한 관심과 이해를 높이고 동 분야의 인재양성에 기여하고자 매년 Open House를 진행하고 있습니다. 제 7회 Open House에서는 국제개발협력의 연구동향과 사례소개 및 국제기구 진출 전략에 관한 발표가 진행될 예정입니다.   주제: 제 7회 GDI Open House “국제개발협력 길라잡이”  일시: 2023년 10월 12일(목) 15시  장소: 서울대학교 행정대학원 57동 204호 (온라인/오프라인 동시 진행)  주최: 글로벌행정발전연구소(GDI)   - GDI의 연구와 교육 프로그램 (서울대학교 권혁주 교수)  - A Comparative Analysis of Koreas and Chinas Relations with Sub-Saharan Africa through Foreign Aid and Trade (한국외국어대학교 Ben Katoka 교수)  - 국제개발협력 최근 연구동향 (서울대학교 최창용 교수)  - 국제개발협력분야 요구 역량 (KOICA 평가실 최여정 과장)   참가신청안내:  참가신청은 사전참가신청링크(https://forms.gle/nQaQ29sNRxdR87JY7)를 통해 양식작성 부탁드리며 사전등록자에 한해 이메일로 Webex 접속링크를 보내드릴 예정입니다. 포스터의 QR코드를 통한 참가신청도 가능합니다.   식사는 현장 참석자에 한하여 선착순으로 제공될 예정입니다.   문의:snugdi@gmail.com/ 02-880-4142  많은 관심 부탁드립니다.
학술,뉴노멀 시대의 재난관리,2023-11-09,서울대학교 행정대학원 57동 203호,서울대학교 행정대학,서울대학교 행정대학원 한국정책지식센터에서는 2023년 10월 4일(수)에 New Normal 시대의 재난관리라는 주제로 전문가를 모셔 의견을 듣고 토론함으로써 정책 및 지식의 확산에 기여하고자 1076회 「정책&지식 포럼」을 준비하였습니다.   관심 있는 분들의 많은 참여를 바랍니다.   본 포럼의 발제는 11시 50분 시작되며 토론을 포함한 모든 과정은 오후 1시경에 종료될 예정입니다.  서울대학교 행정대학원 57동 203호에서 진행 예정입니다.    정책&지식포럼 자료집은 정책지식센터 홈페이지(https://www.know.or.kr)에서 확인하실 수 있습니다.   (당일 오전 11시경 업로드 될 예정입니다.)   ※ 포럼 참여 방법 안내  - URL (https://snu.webex.com/meet/gspaknow) 또는 포스터의 QR코드를 통해 접속
학술,인공지능의 투명성: 소셜 봇 대응의 최선의 방법,2023-11-09,행정대학교 57-1동(신관) 405호,서울대학교 행정대학,ㅇ 주제/Theme : Transparency of AI: The Best Practices of Dealing with Social Bots   ㅇ 일시/Date : 2023년 10월 6일(r금) 오후 4시 / October 6th (Fri) 4 p.m.   ㅇ 연사/Presenter : Loni Hagen (Assistant Professor at School of Information at University of South Florida)   ㅇ 장소/Place :  - (오프라인) 행정대학교 57-1동(신관) 405호 / Room 405 GSPA Building #57-1  - (온라인/Online) https://snu.webex.com/meet/snugdi   ㅇ 문의/Inquiries : hk.cho@snu.ac.kr  greenjuly@snu.ac.kr
학술,학술활동 건전성 강화,2023-11-09,한국과학기술회관(B1) 방송실1,한국과학기술단체총연,2023년 10월 11일(수) 오후 4시 건전한 학술활동 생태계 조성을 위하여 연구자·학술단체·대학의 조화로운 역할 정립 및 바람직한 방향을 모색하고자 < 학술활동 건전성 강화 >를 주제로 포럼을 개최합니다.   이번 포럼이 부실의심 학술지 대응 관련 연구자의 인식 제고 및 대학의 제도 개선 방안 등에 대한  다양한 의견 청취 및 숙의의 장이 될 수 있도록 학내 구성원들의 많은 참여 부탁드립니다.   ○ 일시: 2023년 10월 11일(수) 오후 4시   ○ 장소: 한국과학기술회관(B1) 방송실1 (유튜브 실시간 중계)  ※ 온라인 상(YouTube 한국과총 검색)으로 당일 접속 (별도 사전신청 없음)   ○ 주제: 학술활동 건전성 강화   ○ 문의: 02-880-2074
학술,2023 진로특강 시리즈_졸업하면 뭐할래? (9월 특강,2023-11-09,ZOOM을 통한 비대면 강의 및 질의응답,서울대학교 미술대학,서울대학교 미술대학에서는 2022년 2학기부터 미술 전공 학생들을 위한 진로특강 시리즈를 진행해왔습니다.  2023년에도 창작활동과 더불어 미술계 안팎에서 활약하는 16분의 전문가를 모시고 예술과 삶에 대한 다양한 태도와 생각들을 공유하고 있으니  스스로의 미래를 가늠하는 데 도움이 되도록 많은 관심과 참여 바랍니다.   2023 진로특강 시리즈_졸업하면 뭐할래? (9월 특강)  - 일시: 9. 27. (수) 7:00-10:00 pm  - 대상: 서울대학교 구성원 누구나  - 방법: ZOOM을 통한 비대면 강의 및 질의응답  - 줌 링크: https://snu-ac-kr.zoom.us/j/2983765047 (회의 아이디: 298 376 5047 비밀번호 없음)  - 주최 및 주관: 서울대학교 미술대학 조형연구소  * 진로특강 프로그램은 진실로윤 기금으로 운영되고 있습니다.   1. 이은실 작가(동양화) < 전업 작가로 살아가기 >  7:00~8:30pm 강의와 질의응답  전업 작가가 된 계기와 작가로서 살아남기 위해 했던 노력 일련의 과정들을 나누고자 합니다. 작품 활동을 하면서 일상과의 균형을 유지하고 끊임없이 연구하는 등 작가 커리어를 위한 여러 가지 이야기를 하고자 합니다.   2. 업체eobchae 시각예술 콜렉티브  8:30~10:00pm 강의와 질의응답  우린 무얼 하고 살고 있을까? 과거의 우리가 현재의 우리에게 궁금했을 법한 질문을 스스로 던진다.
학술,기계로 그림 그리기,2023-11-09,줌 (ID: 961 4833 9457/ Passcode,미술대학,안녕하세요.   미술대학이 주관하는 SNU 10-10 Project 일환으로 Jessica In을 모시고 “Drawing with machines”라는 주제로 강연을 개최합니다. 많은 관심과 참여 부탁드립니다.   주제: Drawing with Machines  강연자: Jessica In  일시: 2023.09.26.(화) 오후 2시-3시  장소: 줌 (ID: 961 4833 9457/ Passcode: 369550)   Website: https://www.jessicain.net/  instagram: @shedrawswithcode
학술,알토 대학의 혁신적 창조력,2023-11-09,서울대학교 미술대학 49동 디자인연구동 322호,미술대학 문화예술원,안녕하세요   미술대학과 문화예술원이 공동으로 주관하는 SNU 10-10 Project for Global art & Design에서 Aalto University의 Tuomas Auvinen 학장님을 모시고 Radical Creativity at Aalto University라는 주제로 강연을 개최합니다. 많은 관심과 참여 부탁드립니다.   · 주제: Radical Creativity at Aalto University  · 강연자: Tuomas Auvinen (Dean School of Arts Design and Architecture Aalto University)  · 일시: 2023. 06. 08. (목) 오전 10시-12시  · 장소: 서울대학교 미술대학 49동 디자인연구동 322호   *별도의 예약은 필요 없습니다.  *강연은 영어로 진행되며 별도의 통역은 제공되지 않습니다.  *문의: 문화예술원 박지윤 (culture.snu@snu.ac.kr 02-880-5891)
공연,과학 생명 예술’ 준비 포럼,2023-11-09,서울대학교 파워플랜트 68동 및 온라인,서울대학교 문화예술,. 주제 : ‘과학 생명 예술(Science Life Art)’ 예비 포럼 . 일시 : 2022년 11월 29일(화) 16:00~18:00 . 대상 : Science & Bio Art에 관심 있는 교내외 구성원 누구나 . 장소 : 서울대학교 파워플랜트 68동 및 온라인(@powerplant.seoul 인스타그램 계정을 통해 링크 추후 공개) . 주최 : 서울대학교 문화예술원   “과학이 예술이 되고 예술이 과학이 되는 접점을 탐구합니다”  ‘예술적 과학 vs 과학적 예술’ 혹은 ‘예술인의 과학 vs 과학인의 예술’이라는 구도는 상대를 이해하기 위해 끊임 없이 스스로에게 반문하고 고민할 때에 비로소 성립합니다. 해서 결국 자신의 영역에 대한 깊이 있는 이해를 가능케 하고 더 나아가 예술과 과학이라는 서로 다른 영역 간의 융합을 이끌어냅니다.  < 서울대 문화예술원 ‘과학 생명 예술(Science Life Art: 이하 SLA)’ 예비 포럼 >은 생명이라는 주제를 중심으로 과학-예술 융합 연구 및 창작의 사례와 미래 가능성을 논의하고 서울대학교 내 관련 인프라와 교내 외 연계 네트워크를 탐색하기 위해 마련되었습니다. 이번 예비 포럼을 통해 오늘날 팬데믹과 기후환경위기와 같은 인류세의 문제들에 대해 생명이라는 근원적 차원에서 문제를 재설정하고 새로운 융합적 관점을 제시하는 예술가 과학자 철학자 등 다양한 분야 간 자유로운 대화와 창작의 생태계를 꿈꾸고 있습니다.  따라서 <서울대학교 문화예술원 SLA 예비포럼>은 과학과 예술의 경계를 오가며 연구실적을 축적하는 주요 학자들의 인적 지형도를 그려 보기 위한 자리입니다. 2022년 11월 29일 포럼은 그 여정의 첫 단추로 해외 융합 연구 및 전시 프로그램 기반의 과학예술 생태계 조성 사례 등을 공유하고 향후 발전 방향에 대해 토론하는 자리가 될 것입니다.   [축사] . 최해천 연구부총장(서울대)  [발제 내용] . 김성훈 교수(연세대 약학대학) “BioArt: Past Present Future”  . 전주홍 교수(
공연,2023 공과대학 가을축제: Fall in 공 안내,2023-11-09,11:00-17:00 | 붉은광장. 18:00-23:0,공대학생회,공과대학의 가을을 컨셉으로 기획된 2023 공과대학 가을 축제 <Fall in 공: 가을 나들이>가 9/20(수)에 진행됩니다!  ? 11:00-17:00 | 붉은광장 | 컨텐츠 및 미니게임 포토부스 ? 18:00-23:00 | 풍산마당 | 동아리 및 초청 게스트 공연  세부 내용은 추후 공개될 예정이니 많은 관심 부탁드립니다.
공연,응생화 X 생과부 일일호프,2023-11-09,신촌 바플라이 3호점 단밤.,서울대 응용생물화학,타 대학 타 학과도 참여 가능합니다  “개강도 했는데 … 이제 뭐하지?“ 고민중인 분  남은 2학기를! 더 제대로! 즐기고 싶은 분  올 가을… 롯데월드 함께 갈 인연을 찾는 분  [ 예매 가격 및 사전 예매 링크] 미팅테이블 : 사전예매 : 6000원  일반테이블 : 사전예매 : 5000원 일반테이블 : 현장예매 : 6000원 (* 현장예매보다 사전예매가 1000원 저렴하며 웨이팅이 있을 수 있으니 사전 예약을 추천드립니다.)  합석매니저가 상주할 예정이므로 당일에 합석이 가능합니다 ?새싹 머리띠?를 하고 있는 합석 매니저를 찾아주세요!  사전예약 구글폼 : https://linktr.ee/snu_abcxbiosci 입금계좌 : 카카오뱅크 3333270443661 ㄱㄷㅇ  입금자명은 ‘이름 + 전화번호 끝자리 4자리’ 로 입력해주세요. Ex) 김생생 1234 (동명이인 방지를 위함입니다.) 대표자가 인원수에 맞는 금액을 일괄적으로 입금해야 합니다. 입금자명과 예약자명이 동일해야 합니다.  주의사항 당일 실물 신분증 지참 필수  사진 신분증 학생증 불가  반드시 신분증 (주민등록증 여권 운전면허증)을 지참해주세요! 실물 신분증이 없이 학생증 신분증 사진으로는 입장이 불가능합니다. 바플라이 규정상 99-04년생만 입장가능합니다. 변심으로 인한 당일 환불은 불가능합니다. 웨이팅이 있을 경우 이용 시간은 2시간으로 제한됩니다. 기타 문의 사항은 아래의 인스타 아이디로 DM 부탁드립니다!
공연,2023 서울대학교 예술주간 거리공연,2023-11-09,멀티캠퍼스(관악 연건 평창 시흥) 지역사회(서울대입구역,서울대 예술주간,텍스트 영상 음악(국악) 복합 개막공연 시낭송음악회 음악공연 Music Performance Cine Music Festival 하프와 함께 하는 실내악 창작음악 연주회 아시안 뮤직 콘서트 관악학생생활관 작은 음악회 Borderless Concert 미술전시 Art Exhibition 미술대학 여성동문회(한울회) 세미나 우석갤러리 기획전 회화 설치 등 학생 전시 다원공연 Interdisciplinary Arts 아니말전 trio 게릴라 콘서트 09.22. Fri. ‹시선› ‹Several Me› @치의학대학원 본관 1층 ‹만남› @의과대학 융합관 1층 GDR 앞 복도 음악공연 Music Performance 연건캠퍼스 국악연주회 시낭송회 09.21. Thu. 19:00 @카페 두채 미술전시 Art Exhibition 09.18. Mon. 09.20. Wed. 17:00 @의과대학 융합관 1층 앞마당 미술전시 Art Exhibition 09.18. Mon.— 09.22. Fri. ‹Flows› ‹환희› ‹남녘에서 온 편지› @교육협력동 1층 배곧 아트큐브 음악공연 Music Performance 시흥캠퍼스 런치콘서트 09.19. Tue. 11:30 @교육협력동 1층 로비 음악공연 Music Performance 평창캠퍼스 사운드 오브 윈즈 공연 09.18. Mon. 16:00 @평창캠퍼스 세움광장 *우천 시 본관 1층 로비에서 진행 예정
공연,히스×고어헤드×바운스팩토리 연합공연 36.5,2023-11-09,서울대학교 68동 파워플랜트,서울대 히스 고어헤,재학생 새내기 타대생 모두에게 열려있는 이번 행사는 서울대 파워플랜트 공간에서 열리는 파티 겸 공연입니다! 교내 동아리인 고어헤드 바운스팩토리 히스가 함께하는 공연은 물론이고 파티하면 빠질 수 없는 디제이와 함께하는 음악 케이터링 및 주류(신분증 확인합니다)?도 준비되어있답니다! 멋진 공연을 생동감 넘치게 가까이서 보고 새내기 분들은 미리 다양한 사람들을 만날 수 있는 기회 놓치지 마세요?  대부분 사전 예약으로 진행되며 미리 예약해주신 분들은 무료음료 1잔이 제공되니 링크를 참고해주세요!! 문의사항은 이준서 010-9187-4783으로 부탁드립니다
공연,중앙기독교동아리 CCC 신입부원 모집,2023-11-09,정기 채플: 26동 B101호 목요기도회: 흑석동 명수,중앙기독교동아리 C,CCC(Campus Crusade for Christ)로 여러분을 초대합니다-!  CCC는 캠퍼스복음화를 통해 민족과 세계복음화를 꿈꾸는 선교단체입니다. 서울대학교 CCC는 민족복음화의 최전방이라는 사명을 가지고 다양한 사역들을 펼치고 있습니다.  1. 검증된 중앙 기독교 동아리 서울대 CCC는 서울대기독인연합에 소속되어 있는 건강하고 검증된 선교단체로 학생회관 420호에 동아리방을 두고 있습니다.  2. 전국연합동아리 한국CCC는 서울시 종로구 부암동에 본부를 두고 있으며 국내의 거의 모든 캠퍼스가 함께하고 있습니다. 서울대학교는 중앙대 백석예대 서울교대 숭실대 동양미래대 강서대 총신대와 함께 서울 남팀에 소속되어 있습니다. 매주 목요일에 있는 남팀 기도회를 통해 함께 예배드리고 교제합니다. 여름방학에는 전국의 CCC가 모여 1만명이 넘는 학생들과 함께 여름수련회를 누리고 겨울방학에는 지역별로 금식수련회의 시간도 갖습니다  4. CCC만의 특별한 활동 CCC의 특별한 활동으로는 순모임이 있습니다. 순장(멘토)과 순원(멘티)이 1:1로 만나 신앙적인 교제를 나누고 CCC출판 교재로 지식을 더해가는 시간입니다. 주1회 서로가 맞는 시간에 동아리방이나 카페에서 진행합니다. 가족과 같이 한 명 한 명을 돌보는 사랑을 함께 누리고 싶다면 CCC로 오세요=)  5. 가입방법 -365일 24시간 상시모집! -신입생 재학생 휴학생 교환학생 모두 환영합니당
